{
  "schema_version": "1.0.0",
  "certificate_kind": "authority_chain",
  "authority_chain_id": "auth-chain-tier1-demo",
  "created_at": "2026-05-11T00:00:00Z",
  "execution_status": "synthetic_fixture",
  "authority_path": [
    {"role": "runtime_executor", "authority_id": "auth-execute-demo", "actor": {"actor_id": "agent:demo-governance-agent", "actor_kind": "agent"}, "scope": "synthetic governance fixture execution", "decision_power": "execute"},
    {"role": "evaluator", "authority_id": "auth-evaluate-demo", "actor": {"actor_id": "role:tier1-evaluator", "actor_kind": "role"}, "scope": "fixture validation", "decision_power": "evaluate"},
    {"role": "promoter", "authority_id": "auth-promote-demo", "actor": {"actor_id": "role:tier1-promoter", "actor_kind": "role"}, "scope": "synthetic promotion fixture", "decision_power": "promote"}
  ],
  "separation_of_powers": {"executor_is_not_sole_evaluator": true, "promoter_references_evidence": true, "monitor_independent_from_agent": true},
  "ledger_entry": {"event_id": "auth-chain-tier1-demo-event", "event_type": "fragment_sealed", "created_at": "2026-05-11T00:00:00Z"}
}
